{
  "assembly_recipe": "tools/assemble_developer_image.py",
  "assembly_recipe_sha256": "520cdda28a9b2c4a3652aba873dce324f505d727976953910d3b7e3666d83e40",
  "base_image_id": "sha256:fabbb83309d3767840466b4ccb82a1da9940b76d76ae7d16eedf04d6a540d179",
  "bench_python": {
    "numpy": "2.3.3",
    "psutil": "7.1.0",
    "pyperf": "2.9.0"
  },
  "extraction_recipe": "container/developer-package.py",
  "extraction_recipe_sha256": "bc784ccdf467b29eae02042cd51d4fb97e8f9a495fe66f31edfbadf7652adbff",
  "foundation_lock_sha256": "06679084b2028f1b0d887df28340dba15beb2f520ea13efb09a6a122859e03a9",
  "image_id": "sha256:323daee40b10313e19988592dcb32bb7f0aa6a7e72301ed85a1a9f61aed82e30",
  "image_registry_digest": null,
  "independent_approval": "PENDING",
  "inherited_project_qualification": false,
  "inputs": [
    {
      "bytes": 140421,
      "kind": "signed-metadata",
      "path": "third_party/developer/provenance/InRelease",
      "sha256": "0584fba32e13e0ab8285fb16c27adea1ec03a73669c18702821094fd6ca86675"
    },
    {
      "bytes": 9678380,
      "kind": "signed-metadata",
      "path": "third_party/developer/provenance/Packages.xz",
      "sha256": "7778d3e3f303b7ddb8ce0fe7c8d57473a076c6bf2e8f241f75421d2396352498"
    },
    {
      "bytes": 10540436,
      "kind": "signed-metadata",
      "path": "third_party/developer/provenance/Sources.xz",
      "sha256": "6002f81f463a2d976d84b34170367cc16da2d60bd0ba9ab9d868d6e1c1a935d9"
    },
    {
      "bytes": 55918,
      "kind": "provenance-data",
      "path": "third_party/developer/provenance/debian-archive-keyring.pgp",
      "sha256": "506b815cbb32d9b6066b4a2aa524071e071761e7e7f68c3ac74f3061ba852017"
    },
    {
      "bytes": 59832,
      "kind": "provenance-data",
      "path": "third_party/developer/provenance/selection.json",
      "sha256": "6ef347b6124077a9b4b2cf26b98ab1daeb1257e6e0293d75b5850dc9142f27cb"
    },
    {
      "bytes": 22993,
      "kind": "provenance-data",
      "path": "third_party/developer/provenance/source-provenance.json",
      "sha256": "b947a3d83897a5393488e8a5e1c94e4311cc7508b8ee2fc5cb139c329855e73c"
    },
    {
      "bytes": 3991712,
      "kind": "binary-package",
      "path": "third_party/developer/archives/gdb_16.3-1_amd64.deb",
      "sha256": "f0cd9b3e7b47685cbc43ebfe3207760830cb7b570e615daee6dc91e50040c127"
    },
    {
      "bytes": 3207052,
      "kind": "binary-package",
      "path": "third_party/developer/archives/clangd-19_19.1.7-3+b1_amd64.deb",
      "sha256": "2ad4bc4bf5f69ca727ad1437bf733ba4ec0af09031cec7b80e3098917d24444b"
    },
    {
      "bytes": 175940,
      "kind": "binary-package",
      "path": "third_party/developer/archives/libbabeltrace1_1.5.11-4+b2_amd64.deb",
      "sha256": "ae7119a21627f296fa28a46ece67b01b1cbc87e32e971f8fd7629d0f42d1d4b1"
    },
    {
      "bytes": 32416,
      "kind": "binary-package",
      "path": "third_party/developer/archives/libdebuginfod1t64_0.192-4_amd64.deb",
      "sha256": "399d156a8a631889c71b1fdeb853d8effc40f812870a0b7b0eb09e04eb0dfa5e"
    },
    {
      "bytes": 47792,
      "kind": "binary-package",
      "path": "third_party/developer/archives/libipt2_2.1.2-1_amd64.deb",
      "sha256": "33cfc9090194a993bfab1da4a70a03b4a2d2863894c1d4b506dd4ac093a0073e"
    },
    {
      "bytes": 2159760,
      "kind": "binary-package",
      "path": "third_party/developer/archives/libpython3.13_3.13.5-2+deb13u5_amd64.deb",
      "sha256": "aa4cdb7e15f5f445ab268160d428518a4daf2a086ee3e6ea30f6082785236dea"
    },
    {
      "bytes": 334684,
      "kind": "binary-package",
      "path": "third_party/developer/archives/libsource-highlight4t64_3.1.9-4.3+b1_amd64.deb",
      "sha256": "6d69c221c44345f33af52cc849c5d39438590d5b2030224a6fdb3e6e660f815a"
    },
    {
      "bytes": 491548,
      "kind": "binary-package",
      "path": "third_party/developer/archives/libabsl20240722_20240722.0-4_amd64.deb",
      "sha256": "78c6d7692890990a27cb1d5bbd95b7bfe47a4183ffafec5b30f689f9b58ec6f7"
    },
    {
      "bytes": 497196,
      "kind": "binary-package",
      "path": "third_party/developer/archives/libgrpc++1.51t64_1.51.1-6_amd64.deb",
      "sha256": "af6c139e11d81f828e4e57cc027aeffe3379d3516586408d7fd88a98b1b26ed9"
    },
    {
      "bytes": 2859180,
      "kind": "binary-package",
      "path": "third_party/developer/archives/libgrpc29t64_1.51.1-6_amd64.deb",
      "sha256": "8d7dfdca30c13995a76bbbb36a3e4d245056b800c7f23fda8fd80a01b7307fc6"
    },
    {
      "bytes": 981280,
      "kind": "binary-package",
      "path": "third_party/developer/archives/libprotobuf32t64_3.21.12-11+deb13u1_amd64.deb",
      "sha256": "38c43ec79a043d2b2659fed321725049a7e457096a66691cf6eb0d3a1a8f0e85"
    },
    {
      "bytes": 254872,
      "kind": "binary-package",
      "path": "third_party/developer/archives/libdw1t64_0.192-4_amd64.deb",
      "sha256": "6b41d3895b40eff429dd8013f0c13b6e26371a26491f414dbf66ba86c4c2c3f1"
    },
    {
      "bytes": 189408,
      "kind": "binary-package",
      "path": "third_party/developer/archives/libelf1t64_0.192-4_amd64.deb",
      "sha256": "94497b7e17b6f574a0605b380d454e20d3f01a9c63b70c2a2263f679d30053e1"
    },
    {
      "bytes": 1521120,
      "kind": "binary-package",
      "path": "third_party/developer/archives/libglib2.0-0t64_2.84.4-3~deb13u5_amd64.deb",
      "sha256": "e2baf92c57d1db1753e5781a61450d9a01e7833c7bd2dfe87776a6811c11ecc2"
    },
    {
      "bytes": 45956,
      "kind": "binary-package",
      "path": "third_party/developer/archives/libjson-c5_0.18+ds-1_amd64.deb",
      "sha256": "4fbd5fb4d54c626f05d68abf38a31533fbf1bf4a87068696abe041ee9c974fe0"
    },
    {
      "bytes": 23700,
      "kind": "binary-package",
      "path": "third_party/developer/archives/libdebuginfod-common_0.192-4_all.deb",
      "sha256": "3c775d164b26fc5e8fb1a3606b3de99875cf8ee6e2d9a90018c4d82de2d47f7b"
    },
    {
      "bytes": 77484,
      "kind": "binary-package",
      "path": "third_party/developer/archives/libsource-highlight-common_3.1.9-4.3_all.deb",
      "sha256": "4914dbff96bc9558e467239719fd64f27faaf0c26e5b8cc63cbb460484781e2d"
    },
    {
      "bytes": 98272,
      "kind": "binary-package",
      "path": "third_party/developer/archives/libcares2_1.34.5-1+deb13u1_amd64.deb",
      "sha256": "5034a2c34ea4730797df1a5f6a0ec142d7d09ce6923c06e167f08ad2e69a4218"
    },
    {
      "bytes": 922092,
      "kind": "binary-package",
      "path": "third_party/developer/archives/libprotoc32t64_3.21.12-11+deb13u1_amd64.deb",
      "sha256": "8a96715498f10f8e166411248164448c9a892fa1d5b25f1e02a93ea668fa72aa"
    },
    {
      "bytes": 168920,
      "kind": "binary-package",
      "path": "third_party/developer/archives/libre2-11_20240702-3+b1_amd64.deb",
      "sha256": "128136b987e90b41d1ace03348fcf42fbfb9fec8bb9294332b13eaeadfec4062"
    },
    {
      "bytes": 43296,
      "kind": "binary-package",
      "path": "third_party/developer/archives/ucf_3.0052_all.deb",
      "sha256": "ab5a6d5a621ad07034ce29d0c2587e6e267ecd2975458b2c8a7d0ada77dcb95b"
    },
    {
      "bytes": 8808,
      "kind": "binary-package",
      "path": "third_party/developer/archives/libtext-wrapi18n-perl_0.06-10_all.deb",
      "sha256": "17f98c7c09af8ac3bdbfd5a5dad32f3f51c71b02cdfc411366f49092a395de85"
    },
    {
      "bytes": 24992,
      "kind": "binary-package",
      "path": "third_party/developer/archives/sensible-utils_0.0.25_all.deb",
      "sha256": "873a9b73c3478cc3148cdbf5cc2084949a0a8e4fa16131d1cbc895d2f1f3470e"
    },
    {
      "bytes": 9476,
      "kind": "binary-package",
      "path": "third_party/developer/archives/libtext-charwidth-perl_0.04-11+b4_amd64.deb",
      "sha256": "3a1d44df306e0252e8a16df07eba457bc9f2ef736ee890a1c35ffdfd548eafa0"
    },
    {
      "bytes": 4497859,
      "kind": "development-payload",
      "path": "third_party/developer/payload/development-layer-0.tar.gz",
      "sha256": "cb8766dcba5c695e6f8220ef2a46054393ae7537ce3c1ce1e55f5dfadec33855"
    },
    {
      "bytes": 3067305,
      "kind": "development-payload",
      "path": "third_party/developer/payload/development-layer-1.tar.gz",
      "sha256": "02fad18302b8e25a24d756cdf43703ee5f9af33aef9a9eb2dc56f177e2ffdd70"
    },
    {
      "bytes": 7261582,
      "kind": "development-payload",
      "path": "third_party/developer/payload/development-layer-2.tar.gz",
      "sha256": "167b512701b0c5d56bf748c1461cb61c257f796ff8006c00878cd9f58af6ec7e"
    },
    {
      "bytes": 233180,
      "kind": "development-payload",
      "path": "third_party/developer/payload/development-layer-3.tar.gz",
      "sha256": "82b69b8d0d4613e422d67c87540bebb3fd9f761a10e2ccac468f11e821644908"
    },
    {
      "bytes": 4975682,
      "kind": "development-payload",
      "path": "third_party/developer/payload/development-layer-4.tar.gz",
      "sha256": "a7e9b573809acd2bd3c854a1e001d86b8bff23c7e63c5595295ecb6cee049a8e"
    },
    {
      "bytes": 4505674,
      "kind": "development-payload",
      "path": "third_party/developer/payload/development-layer-5.tar.gz",
      "sha256": "8d725fc751e55f14c39c49ad5b75801b96c01c4fb3d84ae1a388e54b457b2c1c"
    },
    {
      "bytes": 4975713,
      "kind": "development-payload",
      "path": "third_party/developer/payload/development-layer-6.tar.gz",
      "sha256": "b4e1bf8faea9e6eb9ba8fbcb5439be3ac14a5a2d832c648186fd7cf9387f25ea"
    },
    {
      "bytes": 5266981,
      "kind": "development-payload",
      "path": "third_party/developer/payload/development-layer-7.tar.gz",
      "sha256": "5c47df9a5ac92f0ac7518e99af601262e930c3200e42752928973759e6eeda25"
    },
    {
      "bytes": 4348219,
      "kind": "development-payload",
      "path": "third_party/developer/payload/development-layer-8.tar.gz",
      "sha256": "da367074f00bb3bb4c8dc81a28bd224d995794addc5d1df8782d3be17e25bd83"
    },
    {
      "bytes": 5985649,
      "kind": "development-payload",
      "path": "third_party/developer/payload/development-layer-9.tar.gz",